{
  "$schema": "./pricing-meta.schema.json",
  "lastVerified": "2026-07-27",
  "lastVerifiedDisplay": "Jul 27, 2026",
  "lastVerifiedZh": "2026年7月27日",
  "verificationCycleDays": 30,
  "coveragePct": 96,
  "sources": [
    {
      "id": "anthropic",
      "label": "Anthropic Pricing",
      "url": "https://www.anthropic.com/pricing",
      "verifiedAt": "2026-07-15",
      "confidence": "official"
    },
    {
      "id": "openai",
      "label": "OpenAI Platform Pricing",
      "url": "https://platform.openai.com/docs/pricing",
      "verifiedAt": "2026-07-15",
      "confidence": "official"
    },
    {
      "id": "google",
      "label": "Google AI Pricing",
      "url": "https://ai.google.dev/pricing",
      "verifiedAt": "2026-07-15",
      "confidence": "official"
    },
    {
      "id": "deepseek",
      "label": "DeepSeek API Pricing",
      "url": "https://api-docs.deepseek.com/pricing",
      "verifiedAt": "2026-07-15",
      "confidence": "official"
    },
    {
      "id": "zhipu",
      "label": "Zhipu BigModel Pricing",
      "url": "https://open.bigmodel.cn/pricing",
      "verifiedAt": "2026-07-15",
      "confidence": "official"
    },
    {
      "id": "moonshot",
      "label": "Moonshot Kimi Pricing",
      "url": "https://platform.kimi.com/pricing",
      "verifiedAt": "2026-07-15",
      "confidence": "official"
    },
    {
      "id": "xai",
      "label": "xAI Grok Pricing",
      "url": "https://x.ai/pricing",
      "verifiedAt": "2026-07-15",
      "confidence": "official"
    },
    {
      "id": "alibaba",
      "label": "Alibaba Model Studio",
      "url": "https://help.aliyun.com/zh/model-studio/pricing",
      "verifiedAt": "2026-07-15",
      "confidence": "official"
    },
    {
      "id": "tencent",
      "label": "Tencent Hunyuan",
      "url": "https://cloud.tencent.com/product/hunyuan",
      "verifiedAt": "2026-07-15",
      "confidence": "official"
    },
    {
      "id": "baidu",
      "label": "Baidu ERNIE",
      "url": "https://cloud.baidu.com/doc/WENXINWORKSHOP",
      "verifiedAt": "2026-07-15",
      "confidence": "official"
    },
    {
      "id": "bytedance",
      "label": "ByteDance Doubao",
      "url": "https://www.volcengine.com/docs/82379",
      "verifiedAt": "2026-07-15",
      "confidence": "official"
    },
    {
      "id": "mistral",
      "label": "Mistral Pricing",
      "url": "https://mistral.ai/pricing",
      "verifiedAt": "2026-07-15",
      "confidence": "official"
    },
    {
      "id": "together",
      "label": "Together AI Pricing",
      "url": "https://www.together.ai/pricing",
      "verifiedAt": "2026-07-15",
      "confidence": "official"
    }
  ],
  "changeLog30d": 2,
  "recentChanges": [
    {
      "date": "2026-07-20",
      "modelId": "gemini-2-5-pro",
      "summary": "Google AI: Gemini 2.5 Pro input price held at $1.25/1M; cache-read reduced to $0.31/1M (verified via ai.google.dev/pricing)."
    },
    {
      "date": "2026-07-20",
      "modelId": "gpt-5",
      "summary": "OpenAI: GPT-5 cache-read reduced to $0.31/1M (verified via platform.openai.com/docs/pricing)."
    }
  ],
  "disclosure": {
    "en": "APIRank is editorially independent. Prices shown are official list prices verified against each provider's public pricing page. Cache, batch, and committed-use discounts are not modeled in the calculator. Some aggregator prices may include markup.",
    "zh": "APIRank 保持编辑独立性。展示价格为各厂商官网公开价格，已与官方定价页核验。计算器不包含缓存、批量和承诺用量折扣。部分聚合商价格可能含加价。"
  },
  "fxNote": {
    "rate": "$1 ≈ ¥7",
    "rateAsOf": "mid-2026",
    "en": "USD/CNY uses a fixed reference rate (~$1 = ¥7) for calculation stability. Live rate may differ.",
    "zh": "美元/人民币采用固定参考汇率（约 $1 = ¥7）以保证计算稳定性，与实时汇率可能略有差异。"
  }
}
